{
    "cveId": "CVE-2022-36407",
    "version": "1.0.0",
    "timestamp": "2024-12-06T11:32:07.789868+00:00",
    "description": "Insertion of Sensitive Information into Log File vulnerability in Hitachi Virtual Storage Platform, Hitachi Virtual Storage Platform VP9500, Hitachi Virtual Storage Platform G1000, G1500, Hitachi Virtual Storage Platform F1500, Hitachi Virtual Storage Platform 5100, 5500, 5100H, 5500H, Hitachi Virtual Storage Platform 5200, 5600, 5200H, 5600H, Hitachi Unified Storage VM, Hitachi Virtual Storage Platform G100, G200, G400, G600, G800, Hitachi Virtual Storage Platform F400, F600, F800, Hitachi Virtual Storage Platform G130, G150, G350, G370, G700, G900, Hitachi Virtual Storage Platform F350, F370, F700, F900, Hitachi Virtual Storage Platform E390, E590, E790, E990, E1090, E390H, E590H, E790H, E1090H allows local users to gain sensitive information.This issue affects Hitachi Virtual Storage Platform before DKCMAIN Ver. 70-06-74-00/00, SVP Ver. 70-06-58/00 Hitachi Virtual Storage Platform VP9500 before DKCMAIN Ver. 70-06-74-00/00, SVP Ver. 70-06-58/00 Hitachi Virtual Storage Platform G1000, G1500 before DKCMAIN Ver. 80-06-92-00/00, SVP Ver. 80-06-87/00 Hitachi Virtual Storage Platform F1500 before DKCMAIN Ver. 80-06-92-00/00, SVP Ver. 80-06-87/00 Hitachi Virtual Storage Platform 5100, 5500,5100H, 5500H before DKCMAIN Ver. 90-08-81-00/00, SVP Ver. 90-08-81/00, before DKCMAIN Ver. 90-08-62-00/00, SVP Ver. 90-08-62/00, before DKCMAIN Ver. 90-08-43-00/00, SVP Ver. 90-08-43/00 Hitachi Virtual Storage Platform 5200, 5600,5200H, 5600H before DKCMAIN Ver. 90-08-81-00/00, SVP",
    "keyphrases": {
        "rootcause": "",
        "weakness": "",
        "impact": "gain sensitive information",
        "vector": "Insertion of Sensitive Information into Log File",
        "attacker": "local users",
        "product": "Hitachi Virtual Storage Platform",
        "version": [
            "before DKCMAIN Ver. 70-06-74-00/00",
            "SVP Ver. 70-06-58/00"
        ],
        "component": ""
    }
}
