{
  "cveId": "CVE-2023-52435",
  "version": "1.0.0",
  "timestamp": "2024-12-06T11:32:07.789868+00:00",
  "description": "In the Linux kernel, the following vulnerability has been resolved net prevent mss overflow in skb_segment() Once again syzbot is able to crash the kernel in skb_segment() [1] GSO_BY_FRAGS is a forbidden value, but unfortunately the following computation in skb_segment() can reach it quite easily mss = mss * partial_segs 65535 = 3 * 5 * 17 * 257, so many initial values of mss can lead to a bad final result. Make sure to limit segmentation so that the new mss value is smaller than GSO_BY_FRAGS. [1] general protection fault, probably for non-canonical address 0xdffffc000000000e 0000 [#1] PREEMPT SMP KASAN KASAN null-ptr-deref in range [0x0000000000000070-0x0000000000000077] CPU 1 PID 5079 Comm syz-executor993 Not tainted 6.7.0-rc4-syzkaller-00141-g1ae4cd3cbdd0 #0 Hardware name Google Google Compute Engine/Google Compute Engine, BIOS Google 11/10/2023 RIP 0010skb_segment+0x181d/0x3f30 net/core/skbuff.c4551 Code 83 e3 02 e9 fb ed ff ff e8 90 68 1c f9 48 8b 84 24 f8 00 00 00 48 8d 78 70 48 b8 00 00 00 00 00 fc ff df 48 89 fa 48 c1 ea 03 b6 04 02 84 c0 74 08 3c 03 0f 8e 8a 21 00 00 48 8b 84 24 f8 00 RSP 0018ffffc900043473d0 EFLAGS 00010202 RAX dffffc0000000000 RBX 0000000000010046 RCX ffffffff886b1597 RDX 000000000000000e RSI ffffffff886b2520 RDI 0000000000000070 RBP ffffc90004347578 R08 0000000000000005 R09 000000000000ffff R10 000000000000ffff R11 0000000000000002 R12 ffff888063202ac0 R13 0000000000010000 R14 000000000000ffff R15 0000",
  "keyphrases": {
    "rootcause": "",
    "weakness": [
      "null-ptr-deref",
      "overflow"
    ],
    "impact": "general protection fault",
    "vector": "net prevent mss overflow in skb_segment",
    "attacker": "",
    "product": "Linux kernel",
    "version": "6.7.0-rc4-syzkaller-00141-g1ae4cd3cbdd0",
    "component": "skb_segment()"
  },
  "mitreTechnicalImpacts": []
}