{
    "cveId": "CVE-2017-10606",
    "version": "1.0.0",
    "timestamp": "2024-12-11T16:08:24.783251+00:00",
    "description": "Version 4.40 of the TPM (Trusted Platform Module) firmware on Juniper Networks SRX300 Series has a weakness in generating cryptographic keys that may allow an attacker to decrypt sensitive information in SRX300 Series products. The TPM is used in the SRX300 Series to encrypt sensitive configuration data. While other products also ship with a TPM, no other products or platforms are affected by this vulnerability. Customers can confirm the version of TPM firmware via the show security tpm status command. This issue was discovered by an external security researcher. No other Juniper Networks products or platforms are affected by this issue.",
    "keyphrases": {
        "rootcause": "weakness in generating cryptographic keys",
        "weakness": "",
        "impact": "decrypt sensitive information",
        "vector": "",
        "attacker": "attacker",
        "product": "Juniper Networks SRX300 Series",
        "version": "4.40",
        "component": "TPM (Trusted Platform Module) firmware"
    }
}
