{
    "cveId": "CVE-2016-4839",
    "version": "1.0.0",
    "timestamp": "2024-12-11T16:08:24.783251+00:00",
    "description": "The Android Apps Money Forward (prior to v7.18.0), Money Forward for The Gunma Bank (prior to v1.2.0), Money Forward for SHIGA BANK (prior to v1.2.0), Money Forward for SHIZUOKA BANK (prior to v1.4.0), Money Forward for SBI Sumishin Net Bank (prior to v1.6.0), Money Forward for Tokai Tokyo Securities (prior to v1.4.0), Money Forward for THE TOHO BANK (prior to v1.3.0), Money Forward for YMFG (prior to v1.5.0) provided by Money Forward, Inc. and Money Forward for AppPass (prior to v7.18.3), Money Forward for au SMARTPASS (prior to v7.18.0), Money Forward for Chou Houdai (prior to v7.18.3) provided by SOURCENEXT CORPORATION do not properly implement the WebView class, which allows an attacker to disclose information stored on the device via a specially crafted application.",
    "keyphrases": {
        "rootcause": "improper WebView class implementation",
        "weakness": "",
        "impact": "disclose information stored on the device",
        "vector": "specially crafted application",
        "attacker": "attacker",
        "product": [
            "Money Forward",
            "Money Forward for The Gunma Bank",
            "Money Forward for SHIGA BANK",
            "Money Forward for SHIZUOKA BANK",
            "Money Forward for SBI Sumishin Net Bank",
            "Money Forward for Tokai Tokyo Securities",
            "Money Forward for THE TOHO BANK",
            "Money Forward for YMFG",
            "Money Forward for AppPass",
            "Money Forward for au SMARTPASS",
            "Money Forward for Chou Houdai"
        ],
        "version": [
            "prior to v7.18.0",
            "prior to v1.2.0",
            "prior to v1.2.0",
            "prior to v1.4.0",
            "prior to v1.6.0",
            "prior to v1.4.0",
            "prior to v1.3.0",
            "prior to v1.5.0",
            "prior to v7.18.3",
            "prior to v7.18.0",
            "prior to v7.18.3"
        ],
        "component": ""
    }
}
