{
    "cveId": "CVE-2016-8795",
    "version": "1.0.0",
    "timestamp": "2024-12-11T16:08:24.783251+00:00",
    "description": "Huawei CloudEngine 12800 with software V100R002C00, V100R003C00, V100R003C10, V100R005C00, V100R005C10, V100R006C00 CloudEngine 5800 with software V100R002C00, V100R003C00, V100R003C10, V100R005C00, V100R005C10, V100R006C00 CloudEngine 6800 with software V100R002C00, V100R003C00, V100R003C10, V100R005C00, V100R005C10, V100R006C00 CloudEngine 7800 with software V100R003C00, V100R003C10, V100R005C00, V100R005C10, V100R006C00 CloudEngine 8800 with software V100R006C00 and Secospace USG6600 with software V500R001C00 allow remote unauthenticated attackers to craft specific IPFPM packets to trigger an integer overflow and cause the device to reset.",
    "keyphrases": {
        "rootcause": "",
        "weakness": "integer overflow",
        "impact": "device reset",
        "vector": "specific IPFPM packets",
        "attacker": "remote unauthenticated attackers",
        "product": [
            "Huawei CloudEngine 12800",
            "CloudEngine 5800",
            "CloudEngine 6800",
            "CloudEngine 7800",
            "CloudEngine 8800",
            "Secospace USG6600"
        ],
        "version": [
            "V100R002C00",
            "V100R003C00",
            "V100R003C10",
            "V100R005C00",
            "V100R005C10",
            "V100R006C00",
            "V500R001C00"
        ],
        "component": ""
    }
}
